{
  "$schema":"https://json-schema.org/draft/2020-12/schema","title":"LNM source catalogue","type":"object","required":["schema_version","catalog_updated","sources"],
  "properties":{"schema_version":{"type":"string"},"catalog_updated":{"type":"string","format":"date"},"coverage":{"type":"string"},"status_definitions":{"type":"object"},"sources":{"type":"array","items":{"type":"object","required":["id","name","organization","type","status","products","variables","temporal_resolution","spatial_resolution","coverage","url","limitations"],"properties":{"id":{"type":"string"},"name":{"type":"string"},"organization":{"type":"string"},"type":{"type":"string"},"status":{"enum":["archived","documented","not_integrated","investigation_required"]},"products":{"type":"array","minItems":1},"variables":{"type":"array","minItems":1},"temporal_resolution":{"type":"string"},"spatial_resolution":{"type":"string"},"coverage":{"type":"string"},"url":{"type":"string","format":"uri"},"limitations":{"type":"string"}}}}}
}
