{
  "schema_version":"1.0.0","catalog_updated":"2026-11-01","coverage":"Argentina; regional expansion only where source coverage supports it",
  "status_definitions":{"archived":"Dataset stored in this repository; scientific validation may remain incomplete.","documented":"Source documented but no operational connector is claimed.","not_integrated":"Candidate source; access and implementation remain pending.","investigation_required":"Access, coverage, licensing or product availability must be verified."},
  "sources":[
    {"id":"era5","name":"ERA5","organization":"ECMWF / Copernicus; accessed through Open-Meteo Historical API","type":"reanalysis","status":"archived","products":["Daily historical precipitation series for Virasoro grid cell, 1991-2025"],"variables":["precipitation"],"temporal_resolution":"daily in archived series","spatial_resolution":"reanalysis grid; not a point observation","coverage":"Virasoro reference series","url":"https://open-meteo.com/en/docs/historical-weather-api","limitations":"Existing archive is not a complete atmospheric reconstruction and is not a station or radar observation."},
    {"id":"inta_siga","name":"INTA-SIGA","organization":"Instituto Nacional de Tecnología Agropecuaria","type":"surface_observations","status":"archived","products":["National consolidated station observations","Station catalogue and exploratory coverage products"],"variables":["precipitation","other variables subject to field-level metadata review"],"temporal_resolution":"mixed; verify per station and variable","spatial_resolution":"station point","coverage":"182 catalogued stations in archived consolidated dataset","url":"https://siga.inta.gob.ar/","limitations":"Structural integrity does not imply instrumental validation. Confirm units, temporal meaning, duplicates and station history before aggregation."},
    {"id":"corrientes_production","name":"Precipitaciones de Corrientes","organization":"Ministerio de Producción de Corrientes / public repository","type":"administrative_station_records","status":"archived","products":["Daily department records","Monthly department records"],"variables":["precipitation"],"temporal_resolution":"daily and monthly products","spatial_resolution":"department / reporting location as supplied","coverage":"25 departments in archived daily base; coverage is not uniform","url":"https://github.com/deaeconomiactes/Precipitaciones-Lluvias","limitations":"Not every locality is represented. Do not infer a Virasoro observation where no locality-specific record exists."},
    {"id":"smn","name":"Servicio Meteorológico Nacional","organization":"SMN Argentina","type":"surface_observations_and_official_products","status":"documented","products":["Station observations","Official warnings","Public data products subject to availability"],"variables":["temperature","precipitation","humidity","pressure","wind"],"temporal_resolution":"product-dependent","spatial_resolution":"station / product grid","coverage":"Argentina; station and product availability varies","url":"https://www.smn.gob.ar/descarga-de-datos","limitations":"A source reference is not an operational connector. Verify endpoints, terms, latency, station metadata and historical continuity."},
    {"id":"noaa_climate_indices","name":"NOAA Climate Indices","organization":"NOAA CPC / PSL","type":"climate_indices","status":"documented","products":["ONI","ENSO-related indices","Other circulation indices subject to selection"],"variables":["climate indices"],"temporal_resolution":"index-dependent","spatial_resolution":"large-scale index","coverage":"Global / basin-scale indices relevant to South America","url":"https://www.cpc.ncep.noaa.gov/","limitations":"Indices provide climate context; correlation does not establish the cause of an individual storm or rainfall event."},
    {"id":"goes_abi","name":"GOES ABI","organization":"NOAA / NESDIS","type":"geostationary_satellite","status":"not_integrated","products":["ABI visible, infrared and water-vapour channels"],"variables":["radiance","brightness temperature","derived cloud-top products where validated"],"temporal_resolution":"product and scan-mode dependent","spatial_resolution":"channel and product dependent","coverage":"Verify operational satellite, sector and product coverage for Argentina","url":"https://registry.opendata.aws/noaa-goes/","limitations":"No imagery feed is currently claimed. Verify satellite generation, bucket paths, scan cadence, latency and metadata."},
    {"id":"goes_glm","name":"GOES GLM","organization":"NOAA / NESDIS","type":"geostationary_lightning","status":"not_integrated","products":["GLM events, groups and flashes"],"variables":["lightning event/group/flash locations and times"],"temporal_resolution":"product dependent","spatial_resolution":"instrument footprint and product dependent","coverage":"Verify satellite view and usable coverage for Argentina","url":"https://registry.opendata.aws/noaa-goes/","limitations":"No lightning observations are currently ingested. Do not infer flash density from cloud imagery."},
    {"id":"sinarame","name":"SINARAME / Argentine weather radars","organization":"SMN and participating public institutions","type":"weather_radar","status":"investigation_required","products":["Reflectivity","Radial velocity","Doppler and derived products only where openly available"],"variables":["reflectivity","radial_velocity","derived_precipitation"],"temporal_resolution":"radar and product dependent","spatial_resolution":"radar and product dependent","coverage":"National inventory and actual public data access require verification","url":"https://www.argentina.gob.ar/","limitations":"No operational radar feed is claimed. Distinguish original volumes, processed products and published image tiles."},
    {"id":"gpm_imerg","name":"NASA GPM IMERG","organization":"NASA","type":"satellite_precipitation","status":"not_integrated","products":["IMERG Early","IMERG Late","IMERG Final"],"variables":["precipitation rate","precipitation accumulation"],"temporal_resolution":"product-dependent half-hourly and accumulated products","spatial_resolution":"gridded satellite estimate","coverage":"Global","url":"https://gpm.nasa.gov/data","limitations":"Satellite precipitation estimates are not gauge measurements. Preserve latency and distinguish Early, Late and Final runs."},
    {"id":"radiosondes","name":"Radiosonde archives","organization":"NOAA NCEI IGRA / University of Wyoming","type":"upper_air_observations","status":"investigation_required","products":["Radiosonde soundings"],"variables":["pressure","temperature","dew point","wind","height"],"temporal_resolution":"launch schedule and station dependent","spatial_resolution":"sounding station / vertical profile","coverage":"Argentina and nearby stations; availability must be inventoried","url":"https://www.ncei.noaa.gov/products/weather-balloon/integrated-global-radiosonde-archive","limitations":"Do not substitute model profiles for observed soundings without explicitly identifying source type."},
    {"id":"open_nwp","name":"Open numerical weather prediction models","organization":"NOAA / ECMWF / DWD","type":"numerical_model","status":"not_integrated","products":["GFS","GEFS","ECMWF Open Data","ICON"],"variables":["model-dependent atmospheric fields"],"temporal_resolution":"model cycle and forecast step dependent","spatial_resolution":"model and grid dependent","coverage":"Verify geographic coverage and open-data terms for each model","url":"https://www.ncei.noaa.gov/products/weather-climate-models/global-forecast","limitations":"Forecast model output is not an observation. HRRR is not treated as an Argentina-wide source."},
    {"id":"hydrology_networks","name":"INA / SNIH / ICAA","organization":"Argentine public hydrological institutions","type":"hydrological_observations","status":"documented","products":["Water levels","Discharge","Hydrometeorological station records where published"],"variables":["water_level","discharge","precipitation where available"],"temporal_resolution":"station and service dependent","spatial_resolution":"station / basin","coverage":"Basin and station dependent","url":"https://www.argentina.gob.ar/ina/recursos/aplicacionweb-datos-hidrologicos","limitations":"Hydrological context is complementary. Distinguish validated historical series from raw telemetry."},
    {"id":"chirps","name":"CHIRPS","organization":"Climate Hazards Center, UCSB","type":"satellite_gauge_precipitation","status":"not_integrated","products":["CHIRPS precipitation estimates"],"variables":["precipitation"],"temporal_resolution":"daily and pentadal/monthly products","spatial_resolution":"gridded estimate","coverage":"Global land areas","url":"https://www.chc.ucsb.edu/data/chirps","limitations":"Gridded satellite-gauge product, not a direct station observation. Add only where it provides justified complementary value."}
  ]
}